{
  "id": "agent-technical-analyst",
  "name": "Technical Analyst Agent Role",
  "component_type": "agent",
  "purpose": "Primary LLM persona driving Stage 0 research, algorithm verification, and visual metaphor formulation.",
  "capabilities": [
    "Whitepaper and specification parsing",
    "State machine tracing and edge-case verification",
    "KaTeX equation authoring and phonetics derivation"
  ],
  "location": "role:technical-analyst",
  "version": "1.0.0",
  "installation": {
    "required": false,
    "instructions": "Defined as the operational persona for Stage 0."
  },
  "dependencies": [
    "skill-technical-researcher"
  ],
  "compatibility": {
    "apple_silicon_tested": true,
    "runtime": "agent-host",
    "notes": "Executes in parent conversation context."
  },
  "documentation_urls": [
    "AGENTS.md#lifecycle"
  ],
  "licensing": {
    "spdx_identifier": "Proprietary-Workspace",
    "status": "verified",
    "commercial_use": true,
    "notes": "Internal workspace agent specification."
  },
  "security": {
    "requires_filesystem_write": true,
    "requires_network": true,
    "requires_execution": true,
    "sensitive_data_exposure": false,
    "notes": "Operates within defined workspace boundaries."
  },
  "owner": "pedagogy",
  "status": "approved",
  "approval_evidence": "Production certified in Stage 0.",
  "architecture_ref": "ARCHITECTURE.md#s0r",
  "last_verified": "2026-10-30",
  "tags": ["agent-role", "analyst", "research", "math", "stage-0"]
}
