{
  "id": "skill-algorithmic-art",
  "name": "Algorithmic & Generative Art Skill",
  "component_type": "skill",
  "purpose": "Author intentional, deterministic creative coding sketches and generative visuals (Canvas, SVG, Shaders).",
  "capabilities": [
    "2D Canvas flow fields and particle systems",
    "Deterministic PRNG rendering",
    "Blender/Shader integration",
    "Video loop export"
  ],
  "location": ".agents/skills/algorithmic-art",
  "version": "1.0.0",
  "installation": {
    "required": false,
    "instructions": "Built-in workspace skill under .agents/skills/algorithmic-art."
  },
  "dependencies": [],
  "compatibility": {
    "apple_silicon_tested": true,
    "runtime": "agent-host"
  },
  "documentation_urls": [
    ".agents/skills/algorithmic-art/SKILL.md"
  ],
  "licensing": {
    "spdx_identifier": "MIT",
    "status": "verified",
    "commercial_use": true,
    "notes": "Open-source MIT licensed skill."
  },
  "security": {
    "requires_filesystem_write": false,
    "requires_network": false,
    "requires_execution": false,
    "sensitive_data_exposure": false,
    "notes": "Agent skill instructional guide."
  },
  "owner": "motion-graphics",
  "status": "approved",
  "approval_evidence": "Production approved for motion graphics authoring.",
  "architecture_ref": "ARCHITECTURE.md#s4",
  "last_verified": "2026-10-30",
  "tags": [
    "generative-art",
    "creative-coding",
    "canvas",
    "svg",
    "deterministic"
  ]
}