{
  "id": "skill-gsap-utils",
  "name": "GSAP Utility Functions",
  "component_type": "skill",
  "purpose": "Mathematical and array utilities for animations including clamp, mapRange, normalize, and interpolate.",
  "capabilities": [
    "Value normalization and mapping (mapRange)",
    "Clamping and interpolation",
    "Snapping and wrapping",
    "Mulberry32-friendly math"
  ],
  "location": ".agents/skills/gsap-utils",
  "version": "1.0.0",
  "installation": {
    "required": false,
    "instructions": "Built-in workspace skill under .agents/skills/gsap-utils."
  },
  "dependencies": [
    "gsap"
  ],
  "compatibility": {
    "apple_silicon_tested": true,
    "runtime": "agent-host"
  },
  "documentation_urls": [
    ".agents/skills/gsap-utils/SKILL.md"
  ],
  "licensing": {
    "spdx_identifier": "MIT",
    "status": "verified",
    "commercial_use": true,
    "notes": "Open-source MIT licensed skill."
  },
  "security": {
    "requires_filesystem_write": false,
    "requires_network": false,
    "requires_execution": false,
    "sensitive_data_exposure": false,
    "notes": "Agent skill instructional guide."
  },
  "owner": "motion-graphics",
  "status": "approved",
  "approval_evidence": "Production approved for motion graphics authoring.",
  "architecture_ref": "ARCHITECTURE.md#s4",
  "last_verified": "2026-10-30",
  "tags": [
    "gsap",
    "utils",
    "math",
    "interpolation",
    "helpers"
  ]
}