{
  "id": "skill-gsap-frameworks",
  "name": "GSAP Framework Integration (Vue/Svelte)",
  "component_type": "skill",
  "purpose": "GSAP integration with Vue, Svelte, and other reactive frontend frameworks.",
  "capabilities": [
    "Vue onMounted/unmounted cleanup",
    "Svelte onMount scoping",
    "Scoped selector querying"
  ],
  "location": ".agents/skills/gsap-frameworks",
  "version": "1.0.0",
  "installation": {
    "required": false,
    "instructions": "Built-in workspace skill under .agents/skills/gsap-frameworks."
  },
  "dependencies": [
    "gsap"
  ],
  "compatibility": {
    "apple_silicon_tested": true,
    "runtime": "agent-host"
  },
  "documentation_urls": [
    ".agents/skills/gsap-frameworks/SKILL.md"
  ],
  "licensing": {
    "spdx_identifier": "MIT",
    "status": "verified",
    "commercial_use": true,
    "notes": "Open-source MIT licensed skill."
  },
  "security": {
    "requires_filesystem_write": false,
    "requires_network": false,
    "requires_execution": false,
    "sensitive_data_exposure": false,
    "notes": "Agent skill instructional guide."
  },
  "owner": "motion-graphics",
  "status": "approved",
  "approval_evidence": "Production approved for motion graphics authoring.",
  "architecture_ref": "ARCHITECTURE.md#s4",
  "last_verified": "2026-10-30",
  "tags": [
    "gsap",
    "vue",
    "svelte",
    "frameworks"
  ]
}