{
  "id": "shared-video-spec",
  "name": "Motion Lab Production Specification (project.json)",
  "component_type": "shared_asset",
  "purpose": "JSON Schema (v2) for projects/<slug>/project.json: template, style system, delivery formats with sizes and safe areas, fps, duration, quality, timing source (narration, music or fixed), audio settings (narration optional, licensed music, SFX, captions, loudness target) and runtime version. Projects without project.json remain legacy single-format explainers.",
  "capabilities": [
    "Machine validation for multi-format project configuration",
    "Aspect-ratio aware delivery (16:9, 9:16, 1:1) with safe areas",
    "Explicit audio decisions instead of narration-by-default"
  ],
  "location": "specs/video-spec.json",
  "version": "2.0.0",
  "installation": {
    "required": false,
    "instructions": "Stored in specs/video-spec.json."
  },
  "dependencies": [],
  "compatibility": {
    "apple_silicon_tested": true,
    "runtime": "json-schema",
    "notes": "Draft-07 standard schema."
  },
  "documentation_urls": [
    "specs/video-spec.json"
  ],
  "licensing": {
    "spdx_identifier": "Proprietary-Workspace",
    "status": "verified",
    "commercial_use": true,
    "notes": "Internal workspace schema specification."
  },
  "security": {
    "requires_filesystem_write": false,
    "requires_network": false,
    "requires_execution": false,
    "sensitive_data_exposure": false,
    "notes": "Static schema definition."
  },
  "owner": "video-production",
  "status": "experimental",
  "approval_evidence": "v2 rewritten 2026-10-30; validated against projects/masala-chai-recipe/project.json and template project files. v1 was not referenced by any project file.",
  "architecture_ref": "ARCHITECTURE.md#video-spec",
  "last_verified": "2026-10-30",
  "tags": ["schema", "spec", "video", "json-schema", "draft-07"]
}
