{
  "id": "skill-text-to-lottie",
  "name": "Text-to-Lottie Skill (Diffusion Studio)",
  "component_type": "skill",
  "purpose": "Prompt-driven generation of declarative Lottie JSON vector animations, icon bursts, and UI state indicators.",
  "capabilities": [
    "Prompt to Lottie JSON schema generation",
    "Vector shape, trim-path, and keyframe choreography recipes",
    "Deterministic frame-by-frame stepping via lottie-web in HyperFrames"
  ],
  "location": "https://github.com/diffusionstudio/lottie",
  "version": "1.0.0",
  "installation": {
    "required": false,
    "instructions": "Recipe instructions incorporated into motion-library-guide. Consumed via lottie-web runtime."
  },
  "dependencies": [
    "lottie-web",
    "gsap"
  ],
  "compatibility": {
    "apple_silicon_tested": true,
    "runtime": "agent-host",
    "notes": "Verified in HyperFrames with lottie-web SVG renderer on Apple Silicon M2 (120 frames in 10.7s at 1280x720 30fps)."
  },
  "documentation_urls": [
    "https://github.com/diffusionstudio/lottie"
  ],
  "licensing": {
    "spdx_identifier": "Apache-2.0",
    "status": "verified",
    "commercial_use": true,
    "notes": "Apache 2.0 verified (commit 3c72912f)."
  },
  "security": {
    "requires_filesystem_write": false,
    "requires_network": false,
    "requires_execution": false,
    "sensitive_data_exposure": false,
    "notes": "Instructional skill guidelines for Lottie JSON generation."
  },
  "owner": "motion-graphics",
  "status": "experimental",
  "approval_evidence": "Prototyped in tests/prototypes/lottie/. Rendered 120 frames at 1280x720 @ 30fps with 0 dropped frames. Verified deterministic seeking via anim.goToAndStop(playhead.frame, true). Retained as experimental capability.",
  "architecture_ref": "ARCHITECTURE.md#s4",
  "last_verified": "2026-10-30",
  "tags": [
    "lottie",
    "vector-animation",
    "json-motion",
    "experimental"
  ]
}

