{
  "id": "skill-gsap-timeline",
  "name": "GSAP Timeline Orchestration",
  "component_type": "skill",
  "purpose": "Sequential and parallel animation choreography using GSAP TimelineMax and position parameters.",
  "capabilities": [
    "gsap.timeline({ paused: true }) orchestration",
    "Position parameter alignment",
    "Nested timelines",
    "Timeline playback control"
  ],
  "location": ".agents/skills/gsap-timeline",
  "version": "1.0.0",
  "installation": {
    "required": false,
    "instructions": "Built-in workspace skill under .agents/skills/gsap-timeline."
  },
  "dependencies": [
    "gsap"
  ],
  "compatibility": {
    "apple_silicon_tested": true,
    "runtime": "agent-host"
  },
  "documentation_urls": [
    ".agents/skills/gsap-timeline/SKILL.md"
  ],
  "licensing": {
    "spdx_identifier": "MIT",
    "status": "verified",
    "commercial_use": true,
    "notes": "Open-source MIT licensed skill."
  },
  "security": {
    "requires_filesystem_write": false,
    "requires_network": false,
    "requires_execution": false,
    "sensitive_data_exposure": false,
    "notes": "Agent skill instructional guide."
  },
  "owner": "motion-graphics",
  "status": "approved",
  "approval_evidence": "Production approved for motion graphics authoring.",
  "architecture_ref": "ARCHITECTURE.md#s4",
  "last_verified": "2026-10-30",
  "tags": [
    "gsap",
    "timeline",
    "choreography",
    "sequencing",
    "audio-sync"
  ]
}